root@Week1:~#  tcpdump -n -i eth0
17:59:23.665228 IP 167.99.185.101.22 > 99.227.170.200.54967: Flags [P.], seq 1900152:1900316, ack 325, win 501, length 164
17:59:23.665281 IP 167.99.185.101.22 > 99.227.170.200.54967: Flags [P.], seq 1900316:1900480, ack 325, win 501, length 164
17:59:23.665328 IP 99.227.170.200.54967 > 167.99.185.101.22: Flags [.], ack 1851088, win 5894, length 0
17:59:23.665340 IP 99.227.170.200.54967 > 167.99.185.101.22: Flags [.], ack 1852892, win 5887, length 0
17:59:23.665353 IP 99.227.170.200.54967 > 167.99.185.101.22: Flags [.], ack 1853220, win 5885, length 0
17:59:23.665357 IP 99.227.170.200.54967 > 167.99.185.101.22: Flags [.], ack 1853548, win 5884, length 0
17:59:23.665361 IP 99.227.170.200.54967 > 167.99.185.101.22: Flags [.], ack 1855352, win 5877, length 0
17:59:23.665369 IP 99.227.170.200.54967 > 167.99.185.101.22: Flags [.], ack 1857156, win 5870, length 0
17:59:23.665376 IP 99.227.170.200.54967 > 167.99.185.101.22: Flags [.], ack 1859232, win 5862, length 0
17:59:23.665380 IP 99.227.170.200.54967 > 167.99.185.101.22: Flags [P.], seq 325:433, ack 1859232, win 5862, length 108
17:59:23.665383 IP 99.227.170.200.54967 > 167.99.185.101.22: Flags [.], ack 1861036, win 5855, length 0
17:59:23.665389 IP 99.227.170.200.54967 > 167.99.185.101.22: Flags [.], ack 1861364, win 5854, length 0
17:59:23.665392 IP 99.227.170.200.54967 > 167.99.185.101.22: Flags [.], ack 1862512, win 5849, length 0
17:59:23.665397 IP 99.227.170.200.54967 > 167.99.185.101.22: Flags [.], ack 1863168, win 5846, length 0
17:59:23.665400 IP 99.227.170.200.54967 > 167.99.185.101.22: Flags [.], ack 1864972, win 5839, length 0
17:59:23.665406 IP 99.227.170.200.54967 > 167.99.185.101.22: Flags [.], ack 1865628, win 5837, length 0
17:59:23.665562 IP 167.99.185.101.22 > 99.227.170.200.54967: Flags [P.], seq 1900480:1900644, ack 433, win 501, length 164
^C
12325 packets captured
12326 packets received by filter
0 packets dropped by kernel
root@Week1:~# ^C
root@Week1:~# ^C

