root@Week1:~# tcpdump -c 5 -i eth0
tcpdump: verbose output suppressed, use -v or -vv for full protocol decode
listening on eth0, link-type EN10MB (Ethernet), capture size 262144 bytes
17:51:32.100497 IP 167.99.185.101.ssh > cpe9050cad40913-cm9050cad40910.cpe.net.cable.rogers.com.54967: Flags [P.], seq 749286960:749287068, ack 1712578486, win 501, length 108
17:51:32.100576 IP 167.99.185.101.ssh > cpe9050cad40913-cm9050cad40910.cpe.net.cable.rogers.com.54967: Flags [P.], seq 108:144, ack 1, win 501, length 36
17:51:32.100644 IP 167.99.185.101.ssh > cpe9050cad40913-cm9050cad40910.cpe.net.cable.rogers.com.54967: Flags [P.], seq 144:252, ack 1, win 501, length 108
17:51:32.100710 IP 167.99.185.101.ssh > cpe9050cad40913-cm9050cad40910.cpe.net.cable.rogers.com.54967: Flags [P.], seq 252:288, ack 1, win 501, length 36
17:51:32.101175 IP 167.99.185.101.43472 > dns.google.domain: 12674+ PTR? 200.170.227.99.in-addr.arpa. (45)
5 packets captured
16 packets received by filter
0 packets dropped by kernel
